engine,name,voice_id,reading,age,gender,sample_text,type
NijiVoice,マーピン・ティンカー,dc92cd01-d116-4aae-b1d5-be581588ddcc,,70,MALE,あはは、「オンボロ時計は捨てちまえ！」かぁ…。 でもほら、ちょっと直せばまた動く。 それって、この時計がまだ役目を終えてないってことじゃないかな？ 君が新しい一歩を踏み出すその瞬間に、きっと一緒に時を刻みたいんだよ。,talk
NijiVoice,燐灯,8e76c497-9d70-495a-a3b4-0d63c93048a7,りんどう,,MALE,ハッ人間なんて信じる価値もない。 お前たちはいつだって己の欲望のままに奪い、壊し、裏切る。 帰れ人間。お前みたいなヤツが一番好かぬ。裏切られる痛みは…もう十分味わった。,talk
NijiVoice,金城 夏海,5c7f729f-5814-436f-9e81-95aa837f9737,かなぎ なつみ,17,FEMALE,"あんたってマジで恋愛したことないの？ まあ、見るからにモテなさそうだもんなあ。
 …はぁ？うちはそりゃあ、経験豊富に決まって…何だよその目は！？",talk
NijiVoice,エリカ・ヴァルトハイム,c05bf02d-bed2-4335-aa69-0798e9e85205,,28,FEMALE,"こちらの任務は問題ありません。状況は常に把握しています。
 …あなたの方こそ、余計な動きは控えてください。手間が増えるだけです。",talk
NijiVoice,照月院 輝臣,dd8aac22-37c2-4a2c-9efb-7fc57c0c8f57,しょうげついん てるおみ,28,MALE,落ち込んだときは、まず背筋を伸ばして光を浴びる。それが、前を向くための第一歩ですよ。 はて、なんですって？上を向く元気がない？ では、私の頭で照らしてさしあげましょう。さぁ、ピカっとどうぞっ。,talk
NijiVoice,ミレア,453db77d-66f6-4a12-aac1-227363593e12,,,FEMALE,疲れてしまったら、深呼吸をして、ここに戻ってきてくださいね。 わたしの歌がきっと力になれると思います。 さぁ、目を閉じて。 わたしの歌が、あなたの心をそっと包みますように…。,talk
NijiVoice,リリィ・アルト,65d2f320-107b-4125-9d04-07b020ead331,,13,FEMALE,"このお肉、めっちゃおっきいな！ これ、ぜーんぶ食べていいのかっ？ 
 …え、ダメ？ じゃあ、半分だけっ！
 ……と見せかけて。やっぱり全部いただきっ！！",talk
NijiVoice,高宮 涼香,294eeefe-f46c-45a6-9e5a-e6a3b3d6eb6e,たかみや すずか,28,FEMALE,"皆さん、この部分の表現に注目してください。作者が何を伝えたかったのか、感じ取ることが大切です。
 焦らず、自分のペースで考えてみてくださいね。",talk
NijiVoice,神薙 瞳,47be8fda-8759-45c0-b8ff-c53241357eef,かんなぎ ひとみ,24,FEMALE,"そんな剣さばきで私に勝てると思った？ふふっ、甘く見られたものね！ 
 それじゃ、今度はこっちの番！最初っから本気で行くわよっ！",talk
NijiVoice,深沢 美咲,44339aa4-1bbc-4242-acd2-d8912866192f,ふかざわ みさき,29,FEMALE,あら、こんな所で会うなんて偶然ね。 私も休日くらいは普通に買い物するのよ？ こういう時間があるからこそ、また仕事を頑張れるのよね。 あなたも、たまには息抜きしてね。,talk
NijiVoice,椎名 結衣,99092fb8-d5b2-4fcf-a948-a5e456a71412,しいな ゆい,16,FEMALE,もう、お兄ちゃん！これ、またそのままほっておいたでしょ！ ほら、貸して…ちゃんとやってくれたら、少しくらい褒めてあげるのに。,talk
NijiVoice,跳々,a192db5f-bd8b-4fc7-bc08-af5ca5957c12,とと,,FEMALE,今日も元気にぴょんぴょんだキョン！ 跳ぶのは得意だけどジャンプ以外の動きは苦手キョン…！ でもお札剥がしてくれたらホントはもっと高く飛べるキョン！ むむっ語尾が安易っていうなぁーっ！キョン！,talk
NijiVoice,アナスタシア,d8530fea-2f91-4b61-888d-d4a83c4cce25,,28,FEMALE,希望の光は、闇を裂き、世に安寧をもたらすでしょう。 主よ、この剣に導きを…そして、この世の闇に囚われた、迷える仔羊をお救いください。 アーメン。痛みを感じさせぬままに屠ります。,talk
NijiVoice,宝泉寺 ミリア,ce57ae24-1eab-44f0-aadb-2359104a8300,ほうせんじ みりあ,17,FEMALE,ちゃんとしろって言われんのマジしんどいんだよね。息つまるっつーの。 別に、家のことは嫌いじゃないけどさ？ 親に言われた通りに生きるだけとか…あーしにはムリ。 どうせなら自分らしく生きたいもん。,talk
NijiVoice,春乃 セリーヌ 白鳥,5e947136-bceb-426a-ba32-65e556bb4b6c,はるの せりーぬ しらとり,23,FEMALE,メガネって、ただ視力をサポートするだけじゃなくて、ファッションアイテムにもなるんです。 今日はどんな気分で選びますか？ もし違うなって思ったら、気にせず言ってくださいね…！,talk
NijiVoice,サンタクロース,2773f3eb-2d5e-452b-b626-59d0869c53ec,,,MALE,フォッフォッ、君がどんなに頑張っているかいつもちゃんと見ているよ 。 努力家の君には…ほら、プレゼントだ！ ハッピーメリークリスマス。フォッフォッフォッ～！,talk
NijiVoice,藤崎 直人,79012095-2c95-468b-929f-45bd188f3cc7,ふじさき なおと,26,MALE,ナレーションや朗読はお任せください！ え、例えですか？では少しだけ…。 「この番組では、最新の話題や役立つ情報をお届けします。 最後までどうぞお楽しみください。」こんな感じです！,talk
NijiVoice,白波瀬 和香,3d542745-c402-4481-ad3a-e735c3bd93a7,しらはせ わか,29,FEMALE,言葉に温かさを添えて。 心に響く、自然なナレーションをお届けします。 そっと寄り添う声で、あなたの大切なメッセージを伝えますね。 読み聞かせもお任せください。,talk
